{"$schema":"https://json-schema.org/draft/2020-12/schema","$id":"https://novel-production-os.local/schemas/soft-split-manifest.v1.schema.json","type":"object","additionalProperties":false,"required":["schema_version","samples_hash","strategy","entries","split_hash"],"properties":{"schema_version":{"const":"soft-split-manifest.v1"},"samples_hash":{"$ref":"#/$defs/hash"},"strategy":{"const":"stratified-fixed-v1"},"entries":{"type":"array","minItems":90,"maxItems":90,"items":{"type":"object","additionalProperties":false,"required":["sample_id","detector_id","split"],"properties":{"sample_id":{"type":"string"},"detector_id":{"enum":["persona_drift","trope_repeat","word_count_cheat"]},"split":{"enum":["train","calibration","holdout"]}}}},"split_hash":{"$ref":"#/$defs/hash"}},"$defs":{"hash":{"type":"string","pattern":"^sha256:[0-9a-f]{64}$"}}}