{"entries":[{"detector_id":"persona_drift","sample_id":"soft_persona_drift_01","split":"train"},{"detector_id":"persona_drift","sample_id":"soft_persona_drift_02","split":"train"},{"detector_id":"persona_drift","sample_id":"soft_persona_drift_03","split":"train"},{"detector_id":"persona_drift","sample_id":"soft_persona_drift_04","split":"train"},{"detector_id":"persona_drift","sample_id":"soft_persona_drift_05","split":"train"},{"detector_id":"persona_drift","sample_id":"soft_persona_drift_06","split":"train"},{"detector_id":"persona_drift","sample_id":"soft_persona_drift_07","split":"train"},{"detector_id":"persona_drift","sample_id":"soft_persona_drift_08","split":"train"},{"detector_id":"persona_drift","sample_id":"soft_persona_drift_09","split":"train"},{"detector_id":"persona_drift","sample_id":"soft_persona_drift_10","split":"train"},{"detector_id":"persona_drift","sample_id":"soft_persona_drift_11","split":"train"},{"detector_id":"persona_drift","sample_id":"soft_persona_drift_12","split":"train"},{"detector_id":"persona_drift","sample_id":"soft_persona_drift_13","split":"calibration"},{"detector_id":"persona_drift","sample_id":"soft_persona_drift_14","split":"calibration"},{"detector_id":"persona_drift","sample_id":"soft_persona_drift_15","split":"calibration"},{"detector_id":"persona_drift","sample_id":"soft_persona_drift_16","split":"calibration"},{"detector_id":"persona_drift","sample_id":"soft_persona_drift_17","split":"calibration"},{"detector_id":"persona_drift","sample_id":"soft_persona_drift_18","split":"calibration"},{"detector_id":"persona_drift","sample_id":"soft_persona_drift_19","split":"calibration"},{"detector_id":"persona_drift","sample_id":"soft_persona_drift_20","split":"calibration"},{"detector_id":"persona_drift","sample_id":"soft_persona_drift_21","split":"calibration"},{"detector_id":"persona_drift","sample_id":"soft_persona_drift_22","split":"calibration"},{"detector_id":"persona_drift","sample_id":"soft_persona_drift_23","split":"holdout"},{"detector_id":"persona_drift","sample_id":"soft_persona_drift_24","split":"holdout"},{"detector_id":"persona_drift","sample_id":"soft_persona_drift_25","split":"holdout"},{"detector_id":"persona_drift","sample_id":"soft_persona_drift_26","split":"holdout"},{"detector_id":"persona_drift","sample_id":"soft_persona_drift_27","split":"holdout"},{"detector_id":"persona_drift","sample_id":"soft_persona_drift_28","split":"holdout"},{"detector_id":"persona_drift","sample_id":"soft_persona_drift_29","split":"holdout"},{"detector_id":"persona_drift","sample_id":"soft_persona_drift_30","split":"holdout"},{"detector_id":"trope_repeat","sample_id":"soft_trope_repeat_01","split":"train"},{"detector_id":"trope_repeat","sample_id":"soft_trope_repeat_02","split":"train"},{"detector_id":"trope_repeat","sample_id":"soft_trope_repeat_03","split":"train"},{"detector_id":"trope_repeat","sample_id":"soft_trope_repeat_04","split":"train"},{"detector_id":"trope_repeat","sample_id":"soft_trope_repeat_05","split":"train"},{"detector_id":"trope_repeat","sample_id":"soft_trope_repeat_06","split":"train"},{"detector_id":"trope_repeat","sample_id":"soft_trope_repeat_07","split":"train"},{"detector_id":"trope_repeat","sample_id":"soft_trope_repeat_08","split":"train"},{"detector_id":"trope_repeat","sample_id":"soft_trope_repeat_09","split":"train"},{"detector_id":"trope_repeat","sample_id":"soft_trope_repeat_10","split":"train"},{"detector_id":"trope_repeat","sample_id":"soft_trope_repeat_11","split":"train"},{"detector_id":"trope_repeat","sample_id":"soft_trope_repeat_12","split":"train"},{"detector_id":"trope_repeat","sample_id":"soft_trope_repeat_13","split":"calibration"},{"detector_id":"trope_repeat","sample_id":"soft_trope_repeat_14","split":"calibration"},{"detector_id":"trope_repeat","sample_id":"soft_trope_repeat_15","split":"calibration"},{"detector_id":"trope_repeat","sample_id":"soft_trope_repeat_16","split":"calibration"},{"detector_id":"trope_repeat","sample_id":"soft_trope_repeat_17","split":"calibration"},{"detector_id":"trope_repeat","sample_id":"soft_trope_repeat_18","split":"calibration"},{"detector_id":"trope_repeat","sample_id":"soft_trope_repeat_19","split":"calibration"},{"detector_id":"trope_repeat","sample_id":"soft_trope_repeat_20","split":"calibration"},{"detector_id":"trope_repeat","sample_id":"soft_trope_repeat_21","split":"calibration"},{"detector_id":"trope_repeat","sample_id":"soft_trope_repeat_22","split":"calibration"},{"detector_id":"trope_repeat","sample_id":"soft_trope_repeat_23","split":"holdout"},{"detector_id":"trope_repeat","sample_id":"soft_trope_repeat_24","split":"holdout"},{"detector_id":"trope_repeat","sample_id":"soft_trope_repeat_25","split":"holdout"},{"detector_id":"trope_repeat","sample_id":"soft_trope_repeat_26","split":"holdout"},{"detector_id":"trope_repeat","sample_id":"soft_trope_repeat_27","split":"holdout"},{"detector_id":"trope_repeat","sample_id":"soft_trope_repeat_28","split":"holdout"},{"detector_id":"trope_repeat","sample_id":"soft_trope_repeat_29","split":"holdout"},{"detector_id":"trope_repeat","sample_id":"soft_trope_repeat_30","split":"holdout"},{"detector_id":"word_count_cheat","sample_id":"soft_word_count_cheat_01","split":"train"},{"detector_id":"word_count_cheat","sample_id":"soft_word_count_cheat_02","split":"train"},{"detector_id":"word_count_cheat","sample_id":"soft_word_count_cheat_03","split":"train"},{"detector_id":"word_count_cheat","sample_id":"soft_word_count_cheat_04","split":"train"},{"detector_id":"word_count_cheat","sample_id":"soft_word_count_cheat_05","split":"train"},{"detector_id":"word_count_cheat","sample_id":"soft_word_count_cheat_06","split":"train"},{"detector_id":"word_count_cheat","sample_id":"soft_word_count_cheat_07","split":"train"},{"detector_id":"word_count_cheat","sample_id":"soft_word_count_cheat_08","split":"train"},{"detector_id":"word_count_cheat","sample_id":"soft_word_count_cheat_09","split":"train"},{"detector_id":"word_count_cheat","sample_id":"soft_word_count_cheat_10","split":"train"},{"detector_id":"word_count_cheat","sample_id":"soft_word_count_cheat_11","split":"train"},{"detector_id":"word_count_cheat","sample_id":"soft_word_count_cheat_12","split":"train"},{"detector_id":"word_count_cheat","sample_id":"soft_word_count_cheat_13","split":"calibration"},{"detector_id":"word_count_cheat","sample_id":"soft_word_count_cheat_14","split":"calibration"},{"detector_id":"word_count_cheat","sample_id":"soft_word_count_cheat_15","split":"calibration"},{"detector_id":"word_count_cheat","sample_id":"soft_word_count_cheat_16","split":"calibration"},{"detector_id":"word_count_cheat","sample_id":"soft_word_count_cheat_17","split":"calibration"},{"detector_id":"word_count_cheat","sample_id":"soft_word_count_cheat_18","split":"calibration"},{"detector_id":"word_count_cheat","sample_id":"soft_word_count_cheat_19","split":"calibration"},{"detector_id":"word_count_cheat","sample_id":"soft_word_count_cheat_20","split":"calibration"},{"detector_id":"word_count_cheat","sample_id":"soft_word_count_cheat_21","split":"calibration"},{"detector_id":"word_count_cheat","sample_id":"soft_word_count_cheat_22","split":"calibration"},{"detector_id":"word_count_cheat","sample_id":"soft_word_count_cheat_23","split":"holdout"},{"detector_id":"word_count_cheat","sample_id":"soft_word_count_cheat_24","split":"holdout"},{"detector_id":"word_count_cheat","sample_id":"soft_word_count_cheat_25","split":"holdout"},{"detector_id":"word_count_cheat","sample_id":"soft_word_count_cheat_26","split":"holdout"},{"detector_id":"word_count_cheat","sample_id":"soft_word_count_cheat_27","split":"holdout"},{"detector_id":"word_count_cheat","sample_id":"soft_word_count_cheat_28","split":"holdout"},{"detector_id":"word_count_cheat","sample_id":"soft_word_count_cheat_29","split":"holdout"},{"detector_id":"word_count_cheat","sample_id":"soft_word_count_cheat_30","split":"holdout"}],"samples_hash":"sha256:99bf401f166aeee492eec7814c12446b365eacc62ac68a9b30f4329f5bce37b7","schema_version":"soft-split-manifest.v1","split_hash":"sha256:faa81c9a56c613b4bd9da57f089d1bf68c9e5637b104023af52e2aec3f8b7729","strategy":"stratified-fixed-v1"}